{
  "$schema": "https://json-schema.org/draft/2020-12/schema",
  "$id": "https://schemas.portashape.invalid/companion/0.1/fidelity.schema.json",
  "title": "Evidence.FidelityReport v1",
  "type": "object",
  "properties": {
    "id": {
      "type": "string",
      "minLength": 1,
      "maxLength": 512
    },
    "recordType": {
      "const": "Evidence.FidelityReport"
    },
    "schemaVersion": {
      "const": 1
    },
    "createdAt": {
      "type": "string",
      "format": "date-time"
    },
    "updatedAt": {
      "type": "string",
      "format": "date-time"
    },
    "ownerId": {
      "type": "string",
      "minLength": 1,
      "maxLength": 512
    },
    "transformId": {
      "type": "string",
      "minLength": 1,
      "maxLength": 512
    },
    "transformVersion": {
      "type": "string",
      "minLength": 1,
      "maxLength": 512
    },
    "sourceDigest": {
      "type": "string",
      "pattern": "^[a-f0-9]{64}$"
    },
    "targetDigest": {
      "type": "string",
      "pattern": "^[a-f0-9]{64}$"
    },
    "preserves": {
      "type": "array",
      "items": {
        "type": "object",
        "properties": {
          "id": {
            "type": "string",
            "minLength": 1,
            "maxLength": 512
          },
          "sourcePath": {
            "type": "string",
            "minLength": 1,
            "maxLength": 512
          },
          "targetPath": {
            "type": "string",
            "minLength": 1,
            "maxLength": 512
          },
          "explanation": {
            "type": "string",
            "maxLength": 80000
          },
          "requiresAcknowledgement": {
            "type": "boolean"
          }
        },
        "required": [
          "id",
          "sourcePath",
          "explanation",
          "requiresAcknowledgement"
        ],
        "additionalProperties": false
      },
      "maxItems": 100
    },
    "approximates": {
      "type": "array",
      "items": {
        "type": "object",
        "properties": {
          "id": {
            "type": "string",
            "minLength": 1,
            "maxLength": 512
          },
          "sourcePath": {
            "type": "string",
            "minLength": 1,
            "maxLength": 512
          },
          "targetPath": {
            "type": "string",
            "minLength": 1,
            "maxLength": 512
          },
          "explanation": {
            "type": "string",
            "maxLength": 80000
          },
          "requiresAcknowledgement": {
            "type": "boolean"
          }
        },
        "required": [
          "id",
          "sourcePath",
          "explanation",
          "requiresAcknowledgement"
        ],
        "additionalProperties": false
      },
      "maxItems": 100
    },
    "drops": {
      "type": "array",
      "items": {
        "type": "object",
        "properties": {
          "id": {
            "type": "string",
            "minLength": 1,
            "maxLength": 512
          },
          "sourcePath": {
            "type": "string",
            "minLength": 1,
            "maxLength": 512
          },
          "targetPath": {
            "type": "string",
            "minLength": 1,
            "maxLength": 512
          },
          "explanation": {
            "type": "string",
            "maxLength": 80000
          },
          "requiresAcknowledgement": {
            "type": "boolean"
          }
        },
        "required": [
          "id",
          "sourcePath",
          "explanation",
          "requiresAcknowledgement"
        ],
        "additionalProperties": false
      },
      "maxItems": 100
    },
    "requires": {
      "type": "array",
      "items": {
        "type": "object",
        "properties": {
          "id": {
            "type": "string",
            "minLength": 1,
            "maxLength": 512
          },
          "sourcePath": {
            "type": "string",
            "minLength": 1,
            "maxLength": 512
          },
          "targetPath": {
            "type": "string",
            "minLength": 1,
            "maxLength": 512
          },
          "explanation": {
            "type": "string",
            "maxLength": 80000
          },
          "requiresAcknowledgement": {
            "type": "boolean"
          }
        },
        "required": [
          "id",
          "sourcePath",
          "explanation",
          "requiresAcknowledgement"
        ],
        "additionalProperties": false
      },
      "maxItems": 100
    }
  },
  "required": [
    "id",
    "recordType",
    "schemaVersion",
    "createdAt",
    "updatedAt",
    "ownerId",
    "transformId",
    "transformVersion",
    "sourceDigest",
    "targetDigest",
    "preserves",
    "approximates",
    "drops",
    "requires"
  ],
  "additionalProperties": false
}